roll,membrane,date,text
Roll A 3: 1338-41,Cedula,1338/11/13,"A list of men in each Ward appointed and sworn at a Congregation of Mayor and Aldermen on Friday after the Feast of St Martin [11 Nov.] Ao 12 Edw. III [1338], to collect money from various Religious Houses and others holding property in the City, but not bearing lot or paying scot, for the purpose of putting the City into a posture of defence pursuant to the King's command (fn. 1). One third of the rents had been stopped in the hands of the tenants for future collection.  Tower: Simon Turgys, Edmund de Samford.  Billingsgate: Richard de Lamhuth, John Joye.  Bridge: John Lambyn, Arnald le Chaundeler, John Cotekyn, James atte Pirye.  Alegate: Maurice Turgys, Walter Costantyn.  Portsokne: John de Stowe, Peter de Weston.  Lymstrete: William de Algate, William de Sabricheworth.  Bisshopsgate: James Sherman, Ralph Herion.  Cornhull: Ralph de Cantebrugge, John Levelif, Gilbert de Brauncestre, Richard de Farnebergh.  Bradstrete: William Brunne, Richard de Staundone.  Candelwykstrete: John atte Diche, William atte Nok.  Langebourne: Alexander de Watford, John de Bromholm.  Walbrok: John le Neve, Thomas de Farnham, Thomas de Canterbury.  Douegate: Richard Andreu, William de Stanford.  Aldresgate: Thomas de Cantebrugge, John Chaumpeyn, Thomas de Lincoln, John Spray, junior.  Farndone Within: Ralph de Blithe, Richard de Arderne, William de Ippegrave, William de Lindeseye.  Farndone Without: Walter le Marescall, Robert Pekfythel.  Queenhithe: Richard le Rous, Thomas Corteys, William Michel.  Castle-Bainard: Simon de Tornham, John Tornegold.  Crepelgate Within: Thomas de Worsted, John de Keselingbery, Adam Walpol.  Crepelgate Without: Robert de Finchingfeld, Simon Seman.  Colman Strete: Philip Gentyl, Henry de Ware.  Cheap: Adam de St Albans, John de Enefeld, Thomas de Waldene.  Bredstrete: John de Denham, John de Kingestone, John de Toppesfeld, Hamo le Barber.  Vintry: Simon Hauteyn, John Fynch.  Bassieshaghe: John de Dalling, Nicholas de Bedingtone, Thomas West.  Cordewanerstrete: John atte Gate, William de Chelrych."
Roll A 3: 1338-41,Cedula dors.,1338/11/13,"Moneys received: The Prior of the Church of Holy Trinity, 10 marks; the Prioress of Kelbourne, 10s; the Master of St Thomas of Acon, 40s; the Dean and Chapter of St Martin's, 40s; William de Fynchyngfeld, 20s, part payment of 40s; Adam Basset, 1 mark; the Dean and Chapter of St Paul's, 10 marks; the Prioress of Clerkenwell, 60s; John, Rector of St Peter's, Cornhull, 1 mark; the Abbess of Berkyng...; the Abbess of St Clare without Algate, 100s; the Prioress of Haliwell, 80s, part payment of 100s; William de Horwod, 20s; Joan, widow of John de Bokelond, knight, 20s; the Abbot of Lesnes, 20s; the Prior of the Hospital of St John of Jerusalem, 5 marks by pledge of John de Dyngele; the Prior of the New Hospital without Bishopsgate, 20 marks; the Master of the Hospital of St Bartholomew, Smithfield, 5 marks; William Fitz Martin, 2 marks; the Abbot of Westminster, £4; the Prior of Bermundeseye, 5 marks; Sir Robert de Hagham, 40s; Sir William de Everdone, excused by the Mayor and Roger de Depham; the Master of the Hospital of St Giles, 50s; Stephen de Canterbury, 20s; the Abbot of Redyng, 40s, by pledge of Adam de Gillyngham; the Abbot of Waltham, 40s, by pledge of Thomas de Maryns; Nicholas Larmurer, 10s; the Prior of Tortyngton, 1 mark; Thomas Passelewe, 20s; Thomas de Lambourne, 5s, by John de Shirbourne."
Roll A 3: 1338-41,Membr. 1,1339/03/28,"At a Congregation of Mayor and Aldermen on Easter Sunday afternoon [28 March] Ao 13 Edw. III [1339], arrangements were made to keep guard over the Thames by night (fn. 2) for fear of foreign invasion. Four Aldermen were assigned to watch each night with the good men of their Wards. (L)"
Roll A 3: 1338-41,Membr. 1,1339/03/31,"Precept sent to the Aldermen on Wednesday in Easter week, charging each to make a return of the number of men-at-arms, arbalesters, archers and men capable of bearing arms or finding substitutes in his Ward. The men-at-arms are to be enrolled in the constabulary and the others organised in vintaines and centaines (fn. 3). (F) Richard de la Pole, Alderman of Bishopsgate, John de Caustone, Alderman of Lime Street, and Richard de Berkyng, Alderman of Aldgate, with the men of their Wards, were assigned on the same day to guard Aldgate and Bishopsgate. (L) Names of the carpenters sworn to guard the engines of war stored in the new house near Petywales (fn. 4) for the defence of the City. (L)"
Roll A 3: 1338-41,Membr. 1,1339/04/05,"A Congregation of Mayor and Aldermen on Monday after the Feast of S t Ambrose [4 April] A o 13 Edw. III [1339] A Genoese, named John de Plesancia of Lumbardy, was charged with buying arms at the Conduit and exporting them for the use of the King's enemies, on the information of John de Horwod. He was found not guilty by a jury. (L)"
Roll A 3: 1338-41,Membr. 1b,1339/04/05,A similar list of men appointed to collect money to that set out on the above cedula. (L)
Roll A 3: 1338-41,Membr. 2,1339/04/05,"A Congregation of Mayor and Aldermen on Monday week after Easter Sunday [28 March] A o 13 Edw. III [1339] Henry de Ware, ironmonger, was attached to answer for an assault on John de Mockyng, Alderman, near the Conduit. A jury was summoned. On Friday the Alderman withdrew the charge and the defendant put himself in mercy. (L) On the same day, John de Gildeford, servant of John de Gloucester, Thomas, servant of John de Triple, and Robert, servant of Adam Brabazon, who had been arrested the previous day for joining in an affray in Cheap, were liberated on bail. (L) The same afternoon Henry de Ware, ironmonger, met the Mayor, Henry Darcy, in the street near the Conduit and accused him of having shown partiality in the recent trial. Thereupon he was committed to the custody of Hugh le Marberer, Sheriff. Being brought before the Mayor on Thursday he admitted his fault, and was pardoned next day, on finding security for his good behaviour. (L)"
Roll A 3: 1338-41,Membr. 2b,1339/04/12,"On Saturday in Easter week the Mayor learnt that a great crowd of fishmongers and goldsmiths were gathered together in Cheap, in consequence of a dispute which had arisen between them in East Cheap the preceding day. Taking with him the Sheriffs and several Aldermen, the Mayor went thither and called upon the more responsible people to compose their differences before Monday. Thereupon John de Mockyng and other fishmongers, and Robert de Shordych and other goldsmiths undertook to do so. Nevertheless next day at the corner of Friday Street and Cheap there was a terrible affray, in which several men were wounded. On the arrival of the Mayor, the rioters fled. The Mayor then ordered the Sheriffs to arrest and bring before him at the Guildhall all who were guilty, and to summon those fish mongers and goldsmiths who had undertaken to keep the peace, as well as a jury of twenty-four men from Cheap and Friday Street, to come before him on Monday. None of the offenders could be discovered by Monday, but next day the leading fishmongers and goldsmiths presented Robert de Fourneux and John Froyssh, called ""de Wetheresfelde,"" fishmongers, for assaulting Peter de Mildenhale and John de Shordyche; and Thomas de Shordyche, Thomas de Cauntebrigge, John de Shordyche and John de Taunton, goldsmiths, for assaulting John de Norwich. As none of these persons could be found by Thursday, and it was impossible to assemble the masters, apprentices, and servants of the two misteries, for the purpose of making peace, except on a Sunday, the matter was postponed till Monday. On that day, the leaders of the two misteries announced that both parties had agreed to keep the peace for the future. A proclamation was made in the presence of the Aldermen and many commoners, calling upon the offenders, who were still in hiding, to surrender before Friday, otherwise proceedings would be taken against them as rebels. (L)"
Roll A 3: 1338-41,Membr. 2b,1339/04/16,"A Congregation of Mayor and Aldermen on Friday 16 April A o 13 Edw. III [1339] at which a great Commonalty was present  Proclamation having been again made that the above persons must surrender before 1 May, otherwise they would be taken alive or dead, Thomas de Shordyche, Thomas de Cantebruge and John de Shordyche surrendered and were committed to Newgate, bail not being allowed. (L) In the same congregation John de Guldesburgh, servant of John de Gloucester, and Thomas, servant of John de Triple, surrendered to their bail and were committed to prison. (L)"
Roll A 3: 1338-41,Membr. 2b,1339/04/20,"On Tuesday after the Feast of St Alphege [19 April] Robert de Evesham, servant of Adam Brabason, having surrendered to prison, was next day bound over to keep the peace. (L) In the same congregation Richard Lacer, William de Brikelesworth and Ralph de Upton, Aldermen, John de Somersham, William Haunsard, John de Gloucester, fishmonger, Thomas de Waledene, Thomas de Canterbury, Thomas de Farnham, Robert de Shordych, William de Thorneye, John de Aylesham, Henry Wymond, John de Dallyng and Henry de Prestone, Commoners, were elected auditors of the accounts of Alan Gille and John Lovekyn, Wardens of London Bridge. The same were appointed auditors of the accounts of Thomas de Marynz, Chamberlain, to be presented on Friday next. (L) Simon Fraunceys, John Hamond, Richard Lacer and Hugh le Marberer were appointed to buy livery-cloth (fn. 5) for the Mayor, Aldermen and Sheriffs against the Feast of Pentecost [16 May]. (L)"
Roll A 3: 1338-41,Membr. 2b,1339/04/17,"A Congregation of Mayor and Aldermen on Saturday before the Feast of S t Alphege [19 April] A o 13 Edw. III [1339] John de Guldesburgh, servant of John de Gloucestre, and Thomas de Kynebelle, servant of John de Triple, were released on bail. (L) Robert Halpany, fishmonger, was bound over to keep the peace. (L)"
Roll A 3: 1338-41,Membr. 2b,1339/04/19,"On Monday the Feast of St Alphege [19 April] Andrew de Portinaire brought a bill of complaint (F) to the effect that he had equipped and paid wages to a man-at-arms, Robyn de Toulouse, to serve overseas, and that the said Robyn had sold some of his equipment, which consisted of a pair of plate-gauntlets, a shirt of good Lumbardy, a pour-point (fn. 6), a dagger and a shield. The above Robert (sic) admitted the offence and was committed to prison."
Roll A 3: 1338-41,Membr. 3,1339/04/20,"A Congregation of Mayor, Aldermen and Sheriffs on Tuesday after the above Feast  Thomas de Shordyche, Thomas de Cantebrugge, and John de Shordyche, goldsmiths, were bound over to keep the peace. (L) John Fynch acknowledged a debt of £15 16s 8d due to William Beauflour. (L) Thomas de Rokeby, called ""le Clerk,"" of co. Warwick, and Margaret la Brewster were arrested at the suit of John de Maudeleyne, servant of John de Hyntone, charged with the mainour (fn. 7) of a silver cup value 5s, which he alleged they had stolen from him at the corner of Bread Street. A jury found a verdict of not guilty. They were acquitted, and order was given to arrest the appellor. (L)"
Roll A 3: 1338-41,Membr. 3,1339/04/21,"A Congregation of Mayor and Aldermen on Wednesday after the above Feast  Robert de Fourneux, fishmonger, and John de Taunton, goldsmith, who had been proclaimed at the Stone Cross in Cheap for the late affray, surrendered to the peace and were committed to prison. On Friday John de Taunton was bound over with eighteen mainpernors to keep the peace. (L) An assessment was made on the Wards in various proportions to raise the sum of 1000 marks by way of composition for the wool tax (fn. 8). (L) Precept to the Alderman of each Ward to assemble the men of his Ward for the purpose of assessing the inhabitants, in order that the Ward quota might be paid into the Guildhall on Friday. (F)"
Roll A 3: 1338-41,Membr. 3b,1339/04/23,A Congregation of Mayor and Aldermen on Friday after the above Feast  The Sheriffs were ordered to distrain the inhabitants of Aldersgate for neglecting to pay the Ward quota. (L)
Roll A 3: 1338-41,Membr. 3b,1339/04/24,"A Congregation of Mayor, Aldermen and an immense Commonalty on Saturday after the Feast of S t George [23 April] the aforesaid year [1339] Robert Fourneux was bound over, with twenty mainpernors, to keep the peace. (L)"
Roll A 3: 1338-41,Membr. 3b,1339/04/16,"Note that at a Congregation of Mayor, Aldermen and an immense Commonalty on 16 April, a proclamation was made at the Stone Cross in Cheap calling upon Robert de Fourneus, John Frossh called ""de Wetheresfeld,"" fishmongers, and Thomas de Shordyche, Thomas de Cantebrugg, John de Shordyche and John de Taunton, goldsmiths, who had been engaged in an armed affray in Cheap on Sunday the Feast of St Ambrose [4 April], to surrender themselves before the first day of May. This proclamation was made in accordance with the promise of the authorities (fn. 9) to hold the City for the King during his absence abroad, and because riots in London, which was the mirror and exemplar (fn. 10) of the whole realm, tended to encourage the King's enemies (F). Appended is a note to the effect that all the above persons had surrendered by the day named except John Frossh. (L)"
Roll A 3: 1338-41,Membr. 3b,1339/05/01,"At a Congregation of Mayor, Aldermen, Sheriffs and Commonalty on 1 May, John Frossh was proclaimed at the Stone Cross as a rebel and banished from the City, for failure to obey the proclamations made at the New Cross in Cheap. (F)"
Roll A 3: 1338-41,Membr. 4,1339/05/01,On the same day certain aldermen and commoners were elected to assist the collectors in getting in 800 marks arrears of the tax of a fifteenth (fn. 11). (L)
Roll A 3: 1338-41,Membr. 4,1339/05/11,"Pleas held before the Mayor, one of the Sheriffs, and the Aldermen on Tuesday after the Feast of S t John ante Portam Latinam [6 May] Reginald de Cornwall, Richard Bene, Henry le Yonge, Roger de Arderne, and John de Essex, carpenters, were charged with making a confederacy among men of their trade to prevent foreign carpenters coming to the City from accepting less than 6d a day, and with having beaten and maimed John de Chalfhonte, who had taken service with Richard Denys for less than that wage (fn. 12). A jury found that they had not beaten the said John Chalfhonte, but that they had intimidated men from taking work for less than 6d a day and an after-dinner drink. The defendants were bound over to come up for judgment. (L)"
Roll A 3: 1338-41,Membr. 4,1339/06/09,"A Congregation of Mayor and Aldermen on Wednesday before the Feast of S t Barnabas [11 June] A o 13 Edw. III [1339] Richard Paterlyng, William Gandre, John de Thremynhale, Thomas Houkyngg, William de Bury and Thomas de Ishmongerelane, sworn overseers of the trade of Pouchmakers (fn. 13), produced a number of confiscated pouches which they declared to be falsely made and of divers skins contrary to rule. The pouches, having been inspected, were ordered to be burnt publicly in Cheap opposite Soper's Lane. (L) At the same congregation John de Borham and Roger le Callere were bound over for using threats to the above overseers for having seized their pouches. (L)"
Roll A 3: 1338-41,Membr. 4b,1339/07/10,"A Congregation of Mayor, Aldermen and Sheriffs on Saturday after the Feast of the Translation of S t  Thomas the Martyr [7 July] A o 13 Edw. III [1339] A jury of twenty-five persons belonging to Farringdon Within, who had presented a number of disorderly persons and nightwalkers before Richard Lacer, the Alderman of the Ward, in his Wardmote held on Friday [2 July] before the said Feast, prayed that the above evildoers might be apprehended and committed to prison. Note that the majority of those named were taken and sent to Newgate, some being subsequently released on bail. (L) At the same congregation Richard Lacer brought the presentment of the twelve jurors of Farringdon Without, made at a Wardmote held in the Church of St Sepulchre on Friday [2 July] after the Feast of St Peter and St Paul [29 June]. They indicted Thomas, son of Simon Nichol, for beating his father, and for being leader of a gang of disorderly persons who terrorized the neighbourhood of Smithfield; Thomas de Hundesmor, dwelling in the Rents of St John of Clerkenwell within the Bar of the New Temple, for being an armed bully and a harbourer of women of ill fame; and several other persons, male and female, for keeping disorderly houses, receiving armed nightwalkers and committing assaults, in consequence of which the neighbours did not dare to come out of doors at night. (F)"
Roll A 3: 1338-41,Membr. 5,1339/07/10,"The names of those who mainprised the bad characters of the Ward of Farringdon Within on various dates before 14 Aug. the same year. The offenders were liberated from Newgate, under security of twelve mainpernors each, to come up for judgment quo & quando. (L)"
Roll A 3: 1338-41,Membr. 5b,1339/08/20,"A Congregation of Mayor, Aldermen and Sheriffs on Saturday after the Feast of the Assumption B.M. [15 Aug.] A o 13 Edw. III [1339] Infangthef. Walter, son of John Barry, taken with the mainour of a supertunic of ""appelblome"" and a tunic of blanket of the value of one mark, which he had stolen from the house of Roger de Barkworth, tailor, on the preceding Thursday evening, was found guilty by a jury. He was hanged. No chattels. (L)"
Roll A 3: 1338-41,Membr. 5b,1339/08/23,"On Monday the eve of St Bartholomew the Apostle [24 Aug.] Salomon Patryk was carried before the Mayor, Sheriffs and Aldermen, having been put in the Tun (fn. 14) overnight by the beadle of Cripplegate Ward Within, for wounding Ralph de Fyfhide in the back with a knife. As the wounded man himself appeared and refused to prosecute, the prisoner was released, on mainprise of three for his good behaviour. (L)"
Roll A 3: 1338-41,Membr. 5b,1339/08/31,"Pleas before the Mayor, Sheriffs and Aldermen on Tuesday after the above Feast  John Janyn was charged with an affray in Cheap. He was acquitted by a jury. (L) John de Aysshbourne, John de Lincoln, bowyer, Robert Doke, James le Botailler, Richard le Cobelere, and John atte Watre, senior, ""cotiller,"" were charged with an affray in St Paul's Churchyard opposite the Bishop's close. They were acquitted by a jury. (L) John de Berkyng, ""latoner (fn. 15),"" was charged with an affray in Ladelane. A jury found him not guilty of an affray, but said that he had struck a certain Henry de Asshindon, tiler, under the jaw because the latter used abusive words to him, and that no hue and cry was raised. A day was given to the defendant to hear judgment. (L)"
Roll A 3: 1338-41,Membr. 5b,1339/07/12,A Congregation of Mayor and Aldermen on Monday after the Feast of the Translation of S t Thomas the Martyr [7 July] A o 13 Edw. III [1339]
Roll A 3: 1338-41,Membr. 6,1339/07/12,Names of those sworn to keep the King's peace in the Wards of Langbourne and Cordwainer Street.
Roll A 3: 1338-41,Membr. 6,1339/08/07,"A Congregation of Mayor and Aldermen on Saturday before the Feast of S t Laurence [10 Aug.] Demise by the Commonalty of the City of London to Philip de Dene, Master of the House of the Order of St Mary of Bedleem without Bishopsgate (fn. 16), of certain tenements appurtenant to the House at an annual rent of 40s. (L) [Schedule of contents of the Roll in a later hand.]"
Roll A 3: 1338-41,Membr. 7,1339/08/31,"Pleas held before the Mayor, Sheriffs and Aldermen on Tuesday after the Feast of S t Bartholomew [24 Aug.] continued  Inquest on the affray in St Paul's Churchyard. The jury find Stephen de Irland, servant of James le Botailler, and Thomas Dooke, servant of John de Lincoln, bowyer, guilty of having wounded William de Lelleworth, vicar of St Paul's, on the night of Sunday after the above Feast, so that his life was despaired of. Precept to the Sheriff to arrest the said Stephen and Thomas. (L)"
Roll A 3: 1338-41,Membr. 7,1339/09/14,"A Congregation of Mayor and Aldermen on Tuesday the Feast of the Exaltation of the Holy Cross [14 Sept.] An inquest was held as to what boatmen were ferrying disturbers of the peace across the Thames at night. The jury found Thomas de Perndon and Richard Boge guilty of so doing, well knowing that their passengers were men of evil character. They were committed to prison, being liberated a week later on mainprise of Hugh FitzRoger and Simon Snellyng, Clerk of the Chamber. (L) An inquest was held the same day as to nightwalkers and others causing disturbances at night. The jury found that John Hamond, cornmeter, Walter de Yerdele, ""werkman,"" John le Cornmongere, ""werkeman,"" Robert de Portesmouthe, junior, saltmeter, John le Keu, oysterseller, Richard le Keu his brother, Simon Melleward, meter, and John Paywell, ""dyeghere,"" dwelling with John de Gedeleston at Billingsgate, were common evildoers and disturbers of the King's peace, and that the aforesaid John, Walter and John had threatened to kill John le Coroner of Vintry Ward and other good men, if they attempted to indict them. Precept was issued to the Sheriffs to arrest the men and bring them up on the following Wednesday. The Sheriffs made return that Robert de Portesmouth, Richard, brother of John le Keu, and John Paywell could not be found. The others pleaded not guilty and put themselves on the country. Subsequently all the indicted persons put themselves on the mercy of the Mayor, Sheriffs and Aldermen, and were bound over for their good behaviour. (L)"
Roll A 3: 1338-41,Membr. 7b,1339/09/15,"A Congregation of Mayor, Sheriffs and Aldermen on Wednesday after the above Feast  On a bill of complaint (F) from John Padegris and Robert his brother, William Whitcrok was charged with having rescued William Sawyer, who had been arrested for assaulting the above Robert and breaking his left shoulder-bone. The defendant's master, Richard Frere, was charged with abetting. The jury found the latter not guilty. William Whitcrok was committed to prison, and a week later was bound over, with eight mainpernors, for his good behaviour. (L)"
Roll A 3: 1338-41,Membr. 7b,1339/09/18,"Note that on Saturday after the above Feast, Richard Broun, carter, was brought up by John le Keu, beadle of Portsoken, for having wounded William de Bathe and created a disturbance on the preceding Thursday night, for which he had been put in the Tun. He was bound over for his good behaviour with two mainpernors. (L)"
Roll A 3: 1338-41,Membr. 7b,1339/10/01,"A Congregation of Mayor and Aldermen on Friday after the Feast of S t Michael [29 Sept.] A letter was read from the Mayor and good men of the town of Leicester to the effect that they had witnessed a deed of release made by Margaret, widow of John Wrenche, to Nicholas Pyk, vintner, of her late husband's lands and tenements in Friday Street in the parish of St Matthew. Dated on Friday after the Feast of the Exaltation of the Holy Cross [14 Sept.]. (F) William de Estwyke, Thomas de Burgate, Thomas de Burneham, Roger de Stonham, and William de Ascote were mainprised not to inflict any injury upon John Ballard. (L)"
Roll A 3: 1338-41,Membr. 8,1339/10/05,"A Congregation of Mayor, Aldermen and a great Commonalty on Tuesday after the Feast of S t Michael [29 Sept.] Henry Pykard, Walter Waldeshef and Roger Fynch were charged with being addicted to playing knuckle-bones (ad talos) at night, leading apprentices into gambling habits, and using threats against citizens and strangers. Order was given for their arrest. They were subsequently mainprised for their good behaviour. (L)"
Roll A 3: 1338-41,Membr. 8,1339/10/12,"On Tuesday before the Feast of St Edward King [13 Oct.] John Scot, cobbler, of St Edmunds was mainprised for his good behaviour. (L)"
Roll A 3: 1338-41,Membr. 8,1339/10/21,"Pleas held before the Mayor, Sheriffs and Aldermen, on Thursday after the Feast of S t Luke [18 Oct.] A o 13 Edw. III [1339] Nicholas le Heymongere, living at Paul's Wharf, was attached to answer a charge of having bought a quantity of hay from John le Keu, servant of Sir William de Everdone, and failing to pay for it. He admitted the debt, and was ordered to prison until he should pay. Thereupon the said John and Nicholas came to terms. (L) John de Chippenham, executor of Simon de Pecham, was summoned to answer a charge of withholding from Matilda, widow of the said Simon, the sum of 100s bequeathed by him to his unborn child. The defendant pleaded that the widow was in possession of the goods of the deceased so bequeathed, and demanded a jury. While the jury was being summoned, the sum of 100s attached on the above John was handed over to the Chamberlain for safe-keeping. The matter was eventually decided on Friday after the Feast of St Martin [11 Nov. (fn. 17) ] when the jury found a verdict for the widow. Judgment was given that the 100s be delivered to the widow under security according to the custom of the City. (L)"
Roll A 3: 1338-41,Membr. 8,1339/11/25,"Note that on Thursday the Feast of St Katherine [25 Nov.] Ao 13 Edw. III [1339], William de Donstaple, tailor, was arrested by the neighbours, on the hue and cry being raised, for having assaulted Peter le Foundour near ""La Ledynhalle,"" and was committed to Newgate. Next day he confessed his fault before the Mayor, and was released on mainprise for his good behaviour. (L)"
Roll A 3: 1338-41,Membr. 8,1339/12/04,"A Congregation of Mayor and Aldermen on Saturday after the Feast of S t Andrew the Apostle [30 Nov.] John Levelyf was attached for having said in Guildhall Yard that the collectors of Cornhill Ward had assessed him unfairly and maliciously at 10s for his share of the £9 6s due from the Ward. The defendant admitted the words and put himself on the mercy of the Mayor, Aldermen and Commonalty. He was ordered to pay his assessment and a fine of 10s, and to be bound over. (L)"
