roll,membrane,date,text
Roll A 3: 1338-41,Membr. 8b,1339/12/04,"Nicholas de Tame and John de Bristoll, junior, were attached to answer a charge of having torn a deed whereby Alice, the widow and executrix of Henry de Seccheford, conveyed to Margaret Rous a certain quitrent of a shop in the parish of St Nicholas Shambles, and of having snatched from Alice and her co-executor, John de Tiddeswelle, the pledges which they had taken in the shop. John de Bristoll admitted having taken the pledges in the presence of the beadle and other good men of the Ward. Nicholas de Tame denied the offences, but was afterwards found guilty by a jury. Both were committed to prison. (L)"
Roll A 3: 1338-41,Membr. 8b,1339/12/07,A Congregation of Mayor and Aldermen on Tuesday the morrow of S t Nicholas [6 Dec.] Inquiry was made by a jury of the venue outside Newgate as to whether or not Simon atte Gate charged the assessors for the Ward of Farringdon Without with dishonesty. He was found not guilty. The assessors were amerced for a false declaration. (L)
Roll A 3: 1338-41,Membr. 9,1339/10/28,"A Congregation of Mayor, Aldermen, Sheriffs and Commonalty on Thursday the Feast of SS. Simon and, Jude [28 Oct.] A o 13 Edw. III [1339] Immediately after Andrew Aubrey had been elected Mayor (fn. 18) loco Henry Darcy, who had been Mayor the two previous years, a certain Gerard Corp ascended the Compter, where the clerks of the City sit, and used opprobrious words to Henry Darcy, saying that the latter had called him an evildoer and a riffler, and that these words would cost Henry Darcy dearer than any words which had been spoken in the City for twenty years; and he went on to say that he could produce twenty witnesses to prove that he never had been a riffler. On hearing these threats, the Mayor, Aldermen and Commonalty committed Gerard Corp to Newgate. On the Wednesday following he appeared before the Mayor etc. and apologized to the above Henry. He was bound over in forty casks of wine for his good behaviour towards him and the other officers of the City, and was mainprised by twelve persons to keep the peace. (L)"
Roll A 3: 1338-41,Membr. 9,1339/11/12,"A Congregation of Mayor, Aldermen, Sheriffs and Commonalty on Friday after the Feast of S t Martin [11 Nov.] A o 13 Edw. III [1339] Ordinances (fn. 19) regulating the sale of wheat to prevent enhancing of prices. (L) Alexander, the Bailiff of Billingsgate, and John Russel, the farmer of the Market, to whom belongs the oversight of all corn sold on the pavement at Newgate and Gracechurch, were sworn to see that the above ordinances were observed, with the assistance of Roger atte Belhous, John Borre, Richard atte Hill, William de Lyndeseye and Richard atte Gate. Thomas Curteys, John de Dytton, John le Coroner, Hugh FitzRoger, Thomas de Leddrede and Geoffrey le Chaundeler were associated with Gilbert atte Halle, the farmer of Queen Hithe, for the same purpose. (L)"
Roll A 3: 1338-41,Membr. 9b,1339/11/12,The Serjeants (named) of the Wards were sworn to keep the King's peace and not to allow any evildoers or persons of ill-fame to remain in their Wards. They were ordered to clean the streets and lanes of the City and to remove all dung and rubbish before Monday week. (L)
Roll A 3: 1338-41,Membr. 9b,1339/11/17,"A Congregation of Mayor and Aldermen on Wednesday after the above Feast  Robert de Hakeneye, Alexander le Gauger and Adam Canoun were sworn to assist the Bailiff of Billingsgate in carrying out the ordinances relating to the sale of wheat. (L) It was agreed that the Sheriffs should summon from each Ward one good man to consult with the Mayor and Aldermen with regard to levying from the more wealthy people a sum of money as a present to the King, Queen and other magnates on their return from abroad. On the Tuesday following the Ward representatives attended and by common consent the Ward quotas were assessed as follows. (L)             £  s    Walebrok:  18  18    Farndon Within:  22  16    Farndon Without:  16  4    Langebourne:  12  12    Algate:  4  10    Tower:  25  16    Billingsgate:  21     Lymstrete:   20    Bredstrete:  18  6    Crepulgate Within:  20  14    Crepulgate Without:  6  18    Portsokne:  4  10    Aldresgate:  5     Bradestrete:  17  8    Colmanstrete:  6  12    Bassieshawe:  4  10    Cornhull:  9  6    Queen Hithe  12     Candlewyk:  9  12    Bridge:  24     Cheap:  36  12    Vinetrie:  23  14    Castle Baynard:  7     Cordewanerstrete:  36  12    Douegate:  21  6    Bishopsgate:  11  8"
Roll A 3: 1338-41,Membr. 10,1339/11/26,"A Congregation of Mayor, Aldermen, and one representative from each Ward on Friday after the Feast of & Katherine [25 Nov.] A o13 Edw. III [1339] Names of men chosen in each Ward to assess the men of their Wards, and to levy the money, with special consideration for the poor.  Farndon Without: William de Waltham, Robert Pekfythele, Robert de Aysshe.  Farndon Within: William de Blythe, William de Ippegrave, Robert de Wyke, John de Crykkele.  Colmanstrete: Henry de Ware, John Bussh.  Cordewanerstrete: Simon Rote, John de Kelyngworth, Roger le Carpenter, Maurice le Ropere.  Bassieshawe: John de Wrytele, Thomas West.  Aldresgate: John Burdeyn, John de Thame.  Queen Hithe: Hugh FitzRoger, Walter de Reynham.  Crepulgate Within: John de Totenham, "" chaundeler,"" Robert de Pertenhale, John de Colewelle.  Bredstrete: John Sprot, William le Botiller, John de Risle, Nicholas Madefray.  Vinetrie: Henry Mongol, John Fynche, John Hardel.  Castle Baynard: Thomas le Koo, Thomas de Cornewaylle.  Cheap: Nicholas de Reygate, John de Carlel.  Crepulgate Without: Hugh atte Cok, Simon Seman.  Bishopsgate: Henry de Northampton, Walter Brett, Ralph Heryoun.  Portesokene: Peter de Westone, Thomas de Caxton, John atte Crouchehous.  Lymstrete: William de Sabrichesworthe, Ralph de Mixsebury.  Walbroke: William de Lycheberghewe, William de Shrovesbury, Robert de Hatfeld, Thomas de Sewell.  Bradestrete: John de Herewardstok, John de Kent, Thomas Lyouns, Richard de Staundon.  Langebourne: Robert de Holewelle, John de Bristoll, barber, John de Sothereye, tapicer, Adam de Bandone.  Candelwykstrate: William atte Stoke, Adam de Canefeld, Henry atte Lanende.  Billingsgate: John de Wrotham, Nicholas Deubeneye, John de Greylond.  Cornhull: Robert de Manhale, Adam Aspal, Robert de Banstede.  Douegate: William de Stanford, Thomas de Spayne, Richard de Enefeld.  Bridge: John Lambyn, William de Mordone, Richard Paterlyng, John Horn, Fleming.  Algate: John de Neubury, Thomas Savage, Walter le Keu.  Tower: Adam Hurel, Edmund de Saunford, Geoffrey de Wynterton. Precept from the Mayor, Aldermen and Commonalty to the assessors, ordering them to bring the money on Friday after the Feast of St Andrew [30 Nov.], with an indenture containing names and amounts. No one is to be assessed having less than 40s in goods and chattels. (F) The following chandlers were sworn to oversee their trade and to prevent bad liquor being put into mustard, sauces and saxifrage (fn. 20) : for the West, John le Chaundeler of St Lawrence Lane, John de Totenham, John de Saunford, Hugh le Chandeler of Eldefisshstret loco John de Saunford, deceased, Walter Cady, William de Douuegate; for the East, Roger de Clovyll, Henry de Stystede, Robert le Chaundeler of Candelwykstrete, John le Chaundeler of Grasscherche. (L) Note that the same persons were sworn before John Hamond, Mayor, on Monday before the Feast of St Katherine [25 Nov.] Ao 17 Edw. III [1343]."
Roll A 3: 1338-41,Membr. 10b,1339/12/07,"A Congregation of Mayor and Aldermen on Tuesday the morrow of S t Nicholas [6 Dec.] A jury of the venue of Coleman Street was summoned to say whether Alan de Causton had charged the assessors of the Ward with unfairness. Before the verdict was given, the said Alan confessed his guilt and was committed to Newgate. Subsequently he was mainprised to pay a fine and released.(L)"
Roll A 3: 1338-41,Membr. 10b,1339/12/10,"Pleas held before the Mayor and Aldermen on Friday after the above Feast  Thomas le Brewere of Tower Street was attached to answer a charge, brought by Nicholas Clompe, of having purchased a quantity of malt and of failing to pay for it at once. The defendant declared that a day was given for payment and that the transaction was not to be in accordance with the Statute of Smithfield (fn. 21). Both parties demanded a jury, but eventually came to terms. (L) The same day John Peverel, goldsmith, was mainprised for his good behaviour by Thomas de Hanneye, Richard de Hanneye, William de Stretham, William de Castre, William de Leylond, goldsmiths, and Egrettus de Bursels, ""lorymer."" (L)"
Roll A 3: 1338-41,Membr. 10b,1339/12/11,"Note that on Saturday after the Feast of St Nicholas [6 Dec.] the same year, precepts were issued to the Aldermen of the Wards to hold their Wardmotes between then and the Feast of St Thomas next ensuing. If any were indicted before them for causes on which they might be arraigned, or for felony or trespass, their names were to be certified under the seal of the indicters at the Guildhall on the morrow of the above Feast. (F)"
Roll A 3: 1338-41,Membr. 11,1339/12/07,"Pleas held before the Mayor and Aldermen on Tuesday the morrow of S t Nicholas [6 Dec.] John le Fevre was attached to answer a charge, brought by Nicholas Clompe, that he bought a quantity of malt in accordance with the Statute of Smithfield and failed to pay for it. The defendant pleaded that he had already paid for it in Friday Street. Both parties claimed a jury. Eventually the plaintiff allowed the defendant to clear himself by his own oath (fn. 22), which the latter did. The defendant was acquitted and the plaintiff was amerced. (L)"
Roll A 3: 1338-41,Membr. 11,1339/12/17,"A Congregation of Mayor and Aldermen on Friday after the Feast of S t Lucia [13 Dec.] A o 13 Edw. III [1339] An ordinance was made to the effect that no one should sell ""Renys Wyn"" at more than 8d a gallon. (L)"
Roll A 3: 1338-41,Membr. 11,1340/01/12,"On Wednesday after the Feast of the Epiphany [6 Jan.], Joan de Romeseye, ""hucstere,"" was bound over for her good behaviour. (L)"
Roll A 3: 1338-41,Membr. 11,1340/01/10,"On Monday after the above Feast, Alice, widow of Henry de Denecoumbe, brought a petition complaining of having been forcibly carried off by robbers, together with 100s and a gold bracelet and other goods, in December last, and praying that the matter may be investigated. (F)"
Roll A 3: 1338-41,"Membr. 12, 12b",1340/03/01,"Memorandum of proceedings relative to a loan of £5000 (fn. 23) to the King with a schedule of subscribers, according to assessment. [Set out in abstract in Cal. of Letter Book F, pp. 45-9, end of para, 1.]"
Roll A 3: 1338-41,"Membr. 12, 12b",1340/03/18,"On Saturday after the Feast of St Gregory [12 March] Ao 14 Edw. III [1340-1], the Mayor, Aldermen and an immense Commonalty appeared before the King and his Council at the House of the Carmelite Friars in the suburbs, when it was agreed that certain citizens should pay the sums at which they were assessed direct to Jacob de Artfeld (fn. 24) at Bruges, to the amount of £1500 out of the above sum of £5000.            £    Andrew Aubrey, Mayor  100    John de Oxford  300    Simon Franceys  300    John Hamond  120    John de Grantham  60    William de Brykelesworth  60    Simon de Brunnesford  40    Richard de Hakeneye  50    Henry de Combemartyn  30    Richard de Rothyng  200    John Anketel  20    John Lovekyn  30    Bartholomew Denmars  60    Walter de Mordone  80    William Box  40    (whereof due from William Brangweyn)  10"
Roll A 3: 1338-41,Membr. 13,1340/03/15,"On Wednesday after the Feast of St Gregory [12 March] Ao 14 Edw. III [1340-1], the Dean and Chapter of St Paul's brought a bill of complaint before the Mayor, Sheriffs and Aldermen praying that John de Neuport might be attached to answer them for resisting a distraint. They declared that their Renter, John de Colcestre, with the assistance of John de Ry, one of the City Serjeants, had taken a distress from John de Neuport's house for arrears of a rent-charge due to the Dean and Chapter; and the above John de Neuport had brought a writ of trespass against the Renter and Thomas de Snodelond, chaplain, whereby they were arrested on a Capias, whereas he ought to have made a plaint of Vee de Naams (fn. 25) in the Guildhall. On a second occasion the said John de Neuport had refused entry to two of the City Serjeants, John de Ry and Nicholas de Abyndon, when they wished to take another distress. (F)"
Roll A 3: 1338-41,Membr. 13,1340/07/11,"On Tuesday after the Feast of the Translation of St Thomas the Martyr [7 July] Ao 14 Edw. III [1340], precept was given to Peter de Hungry, Serjeant of the Chamber, to summon John de Colecestre, mercer, before the Mayor and Chamberlain to show cause why a debt of 40s due to John de Eynesham, skinner, on a recognizance, should not be levied from his goods and chattels. The said John de Colecestre resisted execution on the ground that John de Eynesham had granted him a general acquittance, which he produced. John de Eynesham denied that the document was his deed and demanded a jury. (L) William Pycot, Simon de Shordyche, Simon Haunsard, Nicholas le Leche, and John Yrysshe were mainprised for their good behaviour. (L)"
Roll A 3: 1338-41,Membr. 13b,1340/08/03,"Inquest before the Mayor and Sheriffs on Thursday after the Feast of St Peter ad Vincula [1 Aug.] Ao 14 Edw. III [1340] as to the cause of the affray (fn. 26) which took place in Walbrook Ward on the preceding day. The jury said that on Wednesday afternoon an affray began between Nicholas le Leche, fishmonger, and John de Oxford, servant of Robert de Eynesham, skinner, in front of the latter's shop, owing to an old quarrel; that certain fishmongers named Ralph Turk (fn. 27), Robert Halpeny and Simon Haunsard, who had been accompanying the above Nicholas from the shop of Robert de Shordiche in Cheap towards Bridge Street, turned back to help him, when they were set upon by certain skinners of Walbrook, whose names the jury did not know; Hugh Trappe, skinner, who attempted to stop the fight, was wounded in the head with a knife by Robert Halpeny, and Geoffrey de Hibernia, skinner, was wounded by another fishmonger. (L) Inquest before the Mayor and Sheriffs in the presence of John de Shirbourne, Coroner, as to the conduct of certain fishmongers. The jury returned the names of William atte Felde, John, son of Henry Frossh, Geoffrey his brother, Peter de Fulham, Ralph Thomelyn, John Cros, formerly apprentice of Hugh de Mockyng, Robert Halpeny, Thomas Litle, Edmund, son of Thomas de Ware, John, formerly apprentice of Andrew Cros, Richard, son of John Haunsard, Robert, formerly apprentice of William Swote, and William de Clopham as evildoers and disturbers of the peace, who were rebellious to the wardens of their mistery. They say further that William Turk, fishmonger, abetted them, and that John Sterre, son of Henry Sterre, called ""Monqoi,"" and others assaulted Hugh de Hampton at Eldeneslane, so that his life was despaired of, and that William atte Felde and others had shown violence to the Mayor, Sheriffs and their officials in Bridge Street, and had rescued Robert Halpeny out of the hands of the Sheriff. (L)"
Roll A 3: 1338-41,Membr. 13b,1340/08/02,"Pleas held before the Mayor and Chamberlain (fn. 28) on Wednesday the morrow of S t Peter ad Vincula [1 Aug.] A o 14 Edw. III [1340] Matilda, widow of Thomas de Gloucestre, William de Harewell and John de Litlington, executors of the said Thomas, claimed the sum of 53s 4d from John Priour as due to the estate of the deceased. The defendant denied the liability, and when he came prepared to make his law, the executors failed to appear. Judgment for the defendant. (L)"
Roll A 3: 1338-41,Membr. 14,1340/07/01,"Inquests as to evildoers and disturbers of the King's peace taken before the Mayor and Sheriffs in the presence of John de Shirbourne, Coroner  1. Saturday after the Feast of SS. Peter and Paul [29 June] (fn. 29). A jury of twenty persons from the Wards of Coleman Street, Bassishaw and Cripplegate Within and Without say on oath that as to the Wards first named they have no knowledge, but as regards Cripplegate Without, they say that John Mazerer, Walter Kyng, Thomas ""consanguineus Litelwatte,"" Thomas Fitz Simon, Nicholas de Westsmethfelde, Walter le Tyrteyner and John Wantynge are evildoers, nightwalkers and disturbers of the peace, that John de Catton keeps a common bawdy-house, and that John le Clerk is a receiver of bawds. (L) 2. The same day. A jury drawn from the Wards of Bread Street, Cordwainer Street and Vintry make no presentment. (L) 3. The same day. A jury from the Wards of Castle Baynard, Queen Hithe, Aldersgate, and Farndon Within and Without say that Henry de Pountoys and Nicholas de Kent, brewer, are receivers of men of ill-fame in Aldersgate Ward; that Andrew Wrenne and Beatrice his wife are common evildoers and disturbers of the peace in Castle Baynard Ward, and that on Saturday after the Feast of St Peter ad Vincula [1 Aug.] they assaulted the constable, Richard de Pynnore, Jurdan his serjeant and the latter's boy; that on Saturday before the Feast of St Augustine [5 May] John Assheby, skinner, wounded William de Shepey in Fleet Street, and at another time wounded Agnes la Shepstere in the same place; that Robert son of Clarice la Converse, tailor, wounded Philip de Cornewaille in the same street and is a common evildoer; that William le Chapman is a receiver of malefactors and disorderly women; that Hugh de Staunton is a common evildoer and frequents the house of Alice de Stanewell; that William le Taillour of Shoe Lane assaulted Matilda la Bakere on Sunday before the Feast of St Laurence [10 Aug.] and lies hid at night in Shoe Lane, springing out on honest men passing by. The jurors of the Ward of Farringdon Within make no presentment. (L)"
Roll A 3: 1338-41,Membr. 14,1340/07/05,"4. Wednesday after the Feast of SS. Peter and Paul [29 June] Ao 14 Edw. III [1340]. The jury, drawn from the Wards of Bridge, Billingsgate and Tower, present Andrew le Brewere of the parish of St Andrew Huberd as a man who sleeps by day and wanders about at night, and Richard le Wayte of Essex as a nightwalker with sword and buckler, and an associate of bad characters; they further present that Alice la Jueler of the same parish keeps a disorderly house; that Henry, late keeper of the wharf of Henry Combemartyn, robbed William de Stanes, potter, of twenty-two brass pieces value 40s; that a surgeon, name unknown, is a receiver of bad characters; that Agnes de Chedyngfeld and Clarice la Claterballok do the same and are women of ill-fame; and that a certain Sayer de Valoyns, who dwells with the latter, prefers bad company to good. The jurors of Bridge Ward make no presentment. (L)"
Roll A 3: 1338-41,Membr. 14,1340/07/05,"5. The same day. The jury drawn from the Wards of Broad Street, Walbrook, Dowgate and Candlewick Street present Thomas Whitheved, Joan la Tapstere and William atte Ponde as persons of ill-fame, and say that a house in Apcherche Lane—""atte Pye on the hope""—and a brewhouse near the Church of St Mary Wolnoth are the resort of bad characters; they further say that John le Parker is a receiver of evildoers and women of ill-fame, that John Albon and Master John le Leche are thieves, that Thomas le Keu, ""herberger,"" dwelling in the Rents of the Abbot of St Albans, is a receiver of evildoers and women of ill-fame; that Sarra le Mareschal, dwelling in the Rents of the Archdeacon of Colchester, keeps a disorderly house; that Henry le Taillour receives bad characters; that Walter Walteshelf, Gracian le Palmer and John Walssh are nightwalkers, well dressed and lavish of their money, though no one knows how they get their living, and that these people, if they had their opportunity, would sooner consort with bad characters and disturbers of the peace than with men of good report. The jurors of the Wards of Walbrook and Candlewick Street make no presentment. (L)"
Roll A 3: 1338-41,Membr. 14b,1340/07/05,"6. The same day. The jury, drawn from the Wards of Portsoken, Lime Street, Bishopsgate and Cornhill, present Master Gerard le Armourer, John de Lincoln, ""furbour (fn. 30),"" and John le Keu, ""fevere (fn. 31),"" and his servants, as armed nightwalkers, who had threatened the beadle of Algate Ward because he refused to open the gate for them at midnight. They further present Roger Torold, taverner, and John de Wrytele for harbouring evildoers, and say that women of ill-fame continually resort to James le Sherman's Rent, called ""le Breggehous,"" and the houses of Hugh le Peleter and John le Hosteler. (L)"
Roll A 3: 1338-41,Membr. 14b,1340/08/23,"On Wednesday the eve of St Bartholomew [24 Aug.] Peter de Fulham, who had been committed to Newgate, on an indictment of the men of the mistery of Fishmongers that he was a common evildoer and disobedient to the mistery, was liberated on mainprise. (L)"
Roll A 3: 1338-41,"Membr. 15, 15b",1340/08/23,"Inquests taken before the Sheriffs and Coroner (fn. 32) with regard to the affrays in Walbrook and Bridge Street on Wednesday, 2 Aug. 1340"
Roll A 3: 1338-41,"Membr. 15, 15b",1340/08/03,"1. Thursday after the Feast of St Peter ad Vincula [1 Aug.] Ao 14 Edw. III [1340]. The jurors, after describing the affray in Walbrook, say that the Mayor, with his servants and the Sheriffs and their servants, went thither to stop the affray, and commanded the men of the mistery of Skinners to apprehend the offenders and deliver them to the Sheriffs; that the Mayor etc. immediately went on to Bridge Street to give a like command to the Fishmongers, when Robert Halpeny came up, carrying arms against the King's peace and the proclamation of the City, and was arrested by the Mayor and delivered to Roger de Forsham, Sheriff, but broke his arrest and fled; and that thereupon Thomas, son of John Haunsard, laid violent hands on the Mayor, and that John le Brewere wounded the Mayor's Serjeant, Simon de Berkyng, on the head with a stick, felling him to the pavement, so that his life is now despaired of. (L)"
Roll A 3: 1338-41,"Membr. 15, 15b",1340/08/03,"2. The same day. A different jury made a like presentment, adding that in the affray at Walbrook, William de Croydone, chaplain, helped the fishmongers, who were armed with knives called ""bydaus"" and ""panades,"" and that Robert Furneux and Simon Haunsard took part in the resistance to the Mayor and Sheriffs in Bridge Street. (L)"
Roll A 3: 1338-41,"Membr. 15, 15b",1340/08/03,3-5. The same day. Three further juries made like presentments in the same matter. (L)
Roll A 3: 1338-41,"Membr. 15, 15b",1340/09/09,"Saturday after the Feast of the Nativity B.M. [8 Sept.], Thomas Marvel, ""keu (fn. 33),"" servant of Walter de Schardebourgh, cook, was mainprised for his good behaviour. (L)"
Roll A 3: 1338-41,Membr. 16,1340/08/03,"A Congregation of Mayor, Aldermen, Sheriffs and an immense Commonalty on Thursday after the Feast of S t Peter ad Vincula [1 Aug.] A o 14 Edw. III [1340] The names of seventy-three of the many Commoners who were present. The mode of safeguarding the City (fn. 34) —as undertaken by the civic authorities on the occasion of the King's going abroad in the 12th year of his reign—having been read, the Mayor and Sheriffs reported the affray between the Fishmongers and Skinners in Walbrook on the preceding day, the arrest of Robert Halpeny in Bridge Street and his rescue by Robert Furneux, Simon Haunsard, Thomas, son of John Haunsard, John le Brewere, porter, William atte Felde, William de Clopham, Ralph Thomelyn, fishmongers, and Robert Wygeyn, mariner; and the assault on the Mayor by Thomas, son of John Haunsard, who took the Mayor by the throat, and the wounding of Simon de Berkyng by John le Brewere. The said Thomas and John were brought in, and acknowledged their guilt. Judgment was deferred until Thursday after the Feast of the Decollation of St John the Baptist [29 Aug.], when the Commonalty were asked what penalty should be inflicted on the guilty men. After deliberation the Commonalty, by the mouth of William de Iford their Common Serjeant, declared that they ought to be beheaded immediately by the Stone Cross in Cheap. Thereupon judgment was given by the Mayor, Sheriffs and Aldermen, with the assent of the whole Commonalty, that this sentence be carried out (fn. 35), which was done the same day by the Sheriffs. (L)"
Roll A 3: 1338-41,Membr. 16,1340/08/31,"In the same Congregation on Thursday after the Feast of the Decollation of St John the Baptist [29 Aug.], John de Oxford, skinner, servant of Robert de Aynesham, who had been the chief cause of the affray between the Fishmongers and the Skinners mentioned above, was committed to prison for a year and a day by the Mayor, Sheriffs and Aldermen, with the assent of the whole Commonalty, at the expiration of which term he was to find security for his good behaviour. (L)"
Roll A 3: 1338-41,Membr. 16b,1341/08/31,"At a Congregation of the Mayor and Aldermen on Friday after the above Feast a year later [1341], the above John de Oxford was mainprised for his good behaviour by the following twelve skinners: John de Bedeford, Robert de Eynesham, Thomas de Farnham, Laurence Sely, Walter Page, Simon de Pulham, Robert de Lyncoln, Simon Rote, Robert de Cnapwelle, John Trappe, John de Bury, and Adam de Bury. (L)"
